Question,Answer
What are dower rights in Ohio?,A spouse has a one-third life estate interest in real property owned by the other spouse.
When do dower rights attach?,When a married person acquires real property.
Must both spouses sign a deed to release dower?,Yes, to convey clear title.
Can dower rights exist if only one spouse is on the title?,Yes.
What happens if dower is not released at closing?,The buyer receives title subject to the spouse’s dower interest.
When do dower rights terminate?,Upon death, divorce, or proper release.
What is a land installment contract?,A contract where the buyer makes payments over time and receives title only after full payment.
Who holds legal title during a land installment contract?,The seller retains legal title until the contract is fully paid.
When must a land installment contract be recorded?,Within 20 days of execution.
What happens if a land installment contract is not recorded?,It may be unenforceable against third parties.
How does a land installment contract differ from a mortgage?,Title does not transfer to the buyer until full payment.
Are land installment contracts regulated by Ohio law?,Yes, they are governed by specific statutory requirements.
When is the Ohio Residential Property Disclosure Form required?,For transfers of residential property containing one to four dwelling units.
Who completes the Ohio Property Disclosure Form?,The seller.
What must be disclosed on the form?,Known material defects in the property.
Is the disclosure form a warranty?,No. It is a disclosure of known conditions only.
Are sellers required to inspect the property to complete the form?,No. Only known defects must be disclosed.
Is the disclosure form required for foreclosure sales?,No.
Is the disclosure form required for estate or trustee transfers?,No.
Can a seller be liable for failing to disclose a known material defect?,Yes.
What are mineral rights?,Rights to extract minerals beneath the surface of the land.
Can mineral rights be severed from surface rights?,Yes.
Must a seller disclose if mineral rights have been severed?,Yes.
If mineral rights are previously reserved, does the seller automatically own them?,No.
What is a material defect?,A defect that would affect the value or desirability of the property.
Does Ohio follow caveat emptor?,Yes, but sellers must disclose known material defects.
When does caveat emptor not protect a seller?,When there is fraud, misrepresentation, or concealment of a known defect.
Can a licensee be disciplined for failing to disclose known defects?,Yes.
Is lead-based paint disclosure required in Ohio?,Yes, for residential property built before 1978 under federal law.